he breathed new life into the old house	he brought new life into the old house
our new synthetic fabric breathes and is perfect for summer wear	our new synthetic fabric allows sweat to evaporate and is perfect for summer wear
this rare bordeaux must be allowed to breathe for at least 2 hours	this rare bordeaux must be allowed to be exposed to the air for at least 2 hours
this office is buzzing with activity	this office is full of activity
he buzzed the servant	he signalled the servant with a buzz
she captured all the men's hearts	she made all the men fall in love with her
the judge clapped him in jail	the judge sentenced him to stay in jail
they clawed their way to the top of the mountain.	they climbed their way to the top of the mountain.
she clawed the doorknob.	she scratched the doorknob with nails.
the politician clawed his rival.	the politician harmed his rival politically.
sales were climbing after prices were lowered	sales were increasing after prices were lowered
the path climbed all the way to the top of the hill	the path ascended all the way to the top of the hill
prices climbed steeply	prices increased steeply
the market is being clogged by these operations	the market is being obstructed by these operations
fear clogged her mind	fear impaired her mind
my personal feelings color my judgment in this case	my personal feelings affect my judgment in this case
his political ideas color his lectures	his political ideas make his lectures biased
the rooms communicated	the rooms were interconnected 
his devotion to his sick wife condemned him to a lonely existence	his devotion to his sick wife caused him to have a lonely existence
her feelings condensed	her feelings became more compact
the fire consumed the building	the fire destroyed the building
the comedian convulsed the crowd	the comedian caused the crowd to shake violently because of laughter
you can count on me to help you any time	you can have confidence in me to help you any time
the old cheese was crawling with maggots	the old cheese was covered by maggots
the speech crowned the meeting	the speech culminated the meeting
a weather vane crowns the building	a weather vane is on the top of the building
she was crushed by his refusal of her invitation	she was depressed by his refusal of her invitation
seurat culminated pointillism.	seurat brought pointillism to its best.
dashed by the refusal	discourged by the refusal
it dawned on him that she had betrayed him	it became apparent to him that she had betrayed him
the age of computers had dawned	the age of computers had started
the bad review of his work deflated his self-confidence	the bad review of his work reduced his self-confidence
the new measures deflated the economy	the new measures reduced activities in the economy
the glut of oil depressed gas prices	the glut of oil lowered gas prices
the lack of rain had depressed the water level in the reservoir	the lack of rain had lowered the water level in the reservoir
she designed a good excuse for not attending classes that day.	she made a good excuse for not attending classes that day.
fire had devoured our home	fire had destroyed our home
she devoured his novels	she finished reading his novels
i cannot digest all this information	i cannot understand all this information
the government digested the entire law into a code	the government summarized the entire law into a code
he downed three martinis before dinner.	he drank three martinis before dinner.
some people can down a pound of meat in the course of one meal.	some people can consume a pound of meat in the course of one meal.
stock prices are drifting higher	stock prices are varying higher
my son drifted around for years in california before going to law school	my son lived without a purpose for years in california before going to law school
the stock market drifted upward	the stock market varied upward
the mother drinks in every word of her son on the stage	the mother pays close attention to in every word of her son on the stage
i was drowned in work	i was overwhelmed by work
she drowned her trouble in alcohol	she got rid of her trouble with alcohol
middle age dulled her appetite for travel	middle age made her lose her appetite for travel
the company dumped him after many years of service	the company got rid of him after many years of service
some nice results emerged from the study	some nice results became apparent from the study
the event engraved itself into her memory	the event impressed itself into her memory
the turks erased the armenians in 1915	the turks got rid of the armenians in 1915
the boss exploded when he heard of the resignation of the secretary	the boss became outrageous when he heard of the resignation of the secretary
the middle east is fermenting	the middle east is changing gradually 
fill the child with pride	make the child proud
the night sky flared with the massive bombardment.	the night sky was brightened with the massive bombardment.
the latest intelligence is flashed to all command posts	the latest intelligence is spread fast to all command posts
the republicans are floating the idea of a tax reform	the republicans are suggesting the idea of a tax reform tentatively
the dancer floated across the stage	the dancer moved lightly across the stage
the government floated the ruble for a few months	the government caused the ruble to fluctuate for a few months
the crowd flowed out of the stadium	the crowd went out of the stadium
the sky flushed with rosy splendor	the sky glowed with rosy splendor
the press was gagged	the press was silenced
the moon glared back at itself from the lake's surface	the moon reflected itself from the lake's surface
the sun glared down on us	the sun shone intensively on us
her face glowed when she came out of the sauna	her face became shining when she came out of the sauna
this story will grab you	this story will catch your attention
the conversation gravitated towards politics	the conversation gradually became relevant to politics
the heavy rain guttered the soil.	the heavy rain wore the soil to the gutter.
harmonize one's goals with one's abilities	balance one's goals with one's abilities
these rivers head from a mountain range in the himalayas	these rivers come from a mountain range in the himalayas
the wheat headed early this year	the wheat grew to the head early this year
he heaped him with work	he gave him a lot of work
the oscillator hunts about the correct frequency	the oscillator searches for the correct frequency
the ostentatious way of living of the rich ignites the hatred of the poor	the ostentatious way of living of the rich causes the hatred of the poor
their language inclines us to believe them	their language intends to cause us to believe them
his laughter infects everyone who is in the same room	his laughter affects everyone who is in the same room
the charges were inflated	the charges increased
inflate the currency	increase the amount of currency
he injected new life into the performance	he incorporated new life into the performance
she had to juggle her job and her children	she had to deal with her job and her children at the same time
the gun kicked back into my shoulder.	the gun sprang back into my shoulder.
the businessman kited millions of dollars	the businessman got millions of dollars by using a bad check
this may land you in jail	this may cause you to be in jail
lay the foundation for a new health care plan	cause to have the foundation for a new health care plan
lay a responsibility on someone	impose a responsibility on someone
the news were leaked to the paper	the news were told to the paper
the news leaked out despite his secrecy	the news became known by the public despite his secrecy
we can lean on this man	we can believe the support of this man
The revolution the countryside needs : Christian Wolmar says Britain is lagging behind in setting up ‘ telecottages ’	The revolution the countryside needs : Christian Wolmar says Britain is straggling in setting up ‘ telecottages ’
His speech struck me as the feeblest of the day .	His speech struck me as the lamest of the day .
‘ No , ’ he said helpfully , then bestowed a patronising smile on me .	‘ No , ’ he said helpfully , then formed a patronising smile at me .
He finds out what the needs of the business are , and prescribes the cure .	He finds out what the needs of the business are , and makes a plan to solve the problem .
‘ I think she 'd do better to understand herself , ’ Ellen said tartly .	‘ I think she 'd do better to understand herself , ’ Ellen said ironically.
Outside the capital , accident and emergency services were being provided in most areas , but the ban on emergency work was tightened .	Outside the capital , accident and emergency services were being provided in most areas , but the ban on emergency work was limited .
Oh , and there 's one more thing you can be sure of , ’ he added sourly .	Oh , and there 's one more thing you can be sure of , ’ he added ironically.
We rattled them from the first minute and did n't give them any breathing space .	We worried them from the first minute and did n't give them any breathing space .
But while the DTI would override the Treasury , a new ‘ powerful Department of Consumer Affairs ’ would antagonise the DTI .	But while the DTI would override the Treasury , a new ‘ powerful Department of Consumer Affairs ’ would oppose the DTI .
Instead I lay back in the heather and savoured the trickle of the burn and the crisp smell of peat-laden ground .	Instead I lay back in the heather and enjoyed the trickle of the burn and the crisp smell of peat-laden ground .
We could still be looking for it when they blow us out of the water . ’	We could still be looking for it when they surpassed us . ’
There must be a total retrieval now , the one good thing about which was that it might banish his dreams .	There must be a total retrieval now , the one good thing about which was that it might completely get rid of his dreams .
No one who was at the Brewery Field ( perhaps not even the selectors ) would give twopence for their ability to do so .	No one who was at the Brewery Field ( perhaps not even the selectors ) would care their ability to do so .
Manuals which may contain maps , schematic diagrams and other materials warrant separate consideration .	Manuals which may contain maps , schematic diagrams and other materials need separate consideration .
Naturally , to embark on such a step is not necessarily to succeed immediately in realising it .	Naturally , to start such a step is not necessarily to succeed immediately in realising it .
Despite Mr Dobbs 's tireless efforts , this is another revolution which Britain is likely to be viewing from the sidelines .	Despite Mr Dobbs 's continuous efforts , this is another revolution which Britain is likely to be viewing from the sidelines .
His voice deepened .	His voice became lower.
Therefore the admission which the Prime Minister wrung from him could hardly be said to have been grudging .	Therefore the admission which the Prime Minister requested from him could hardly be said to have been grudging .
Four of the absentees suffered the squirming discomfort of being among the Welsh squad .	Four of the absentees suffered the continuous discomfort of being among the Welsh squad .
It is a curiously paradoxical foundation upon which to build a theory of autonomy .	It is an oddly paradoxical foundation upon which to build a theory of autonomy .
There are few things worse than being bludgeoned into reading a book you hate .	There are few things worse than being forced to read a book you hate .
The effect is rather like an extended advertisement for Marlboro Lights .	The effect is rather like a larger advertisement for Marlboro Lights .
That approach would seek to knock out a keystone of Civil Service tradition .	That approach would seek to knock out the basis of Civil Service tradition .
Did law and meteorology last Easter , and now I 've finished navigation , radiotelephony , and technical — that was the toughest . ’	Did law and meteorology last Easter , and now I 've finished navigation , radiotelephony , and technical — that was the most difficult . ’
The results are terse and sharply etched , like the best line drawings .	The results are concise and sharply etched , like the best line drawings .
The plane climbs reluctantly , one set of wings dipping drunkenly .	The plane climbs reluctantly , one set of wings dipping cumbersomely.
Torchlights , flaring against the night sky and reflected in the water , had been set up wherever it was suitable .	Torchlights , burning against the night sky and reflected in the water , had been set up wherever it was suitable .
Dirty grey clouds tumbled across the sky above the slate roof , now the only thing that shone , glazed with rain .	Dirty grey clouds tumbled across the sky above the slate roof , now the only thing that shone , shining with rain .
‘ When Tony could n't get me to climax , he wanted to ask another girl over , ’ Clare said .	‘ When Tony could n't get me to have orgasm, he wanted to ask another girl over , ’ Clare said .
