We've also made sure it's separate fro the womens loos - after all Dad is just as likely to be left holding the baby.	We've also made sure it's separate fro the womens loos - after all Dad is just as likely to abandon.	
Whilst the Government and the industry struggle to overcome the problems, business is left holding the baby - one the one hand feeling pressured into some sort of web presence and on the other holding back some of the potential for innovation in case it poses a serious risk.	Whilst the Government and the industry struggle to overcome the problems, business abandons - one the one hand feeling pressured into some sort of web presence and on the other holding back some of the potential for innovation in case it poses a serious risk.	
It works stunningly, until the market contracts and some poor sucker is left holding the baby.	It works stunningly, until the market contracts and some poor sucker abandons.	
Many businesses have been left holding the baby following Aprilí€Œ¢í‰ä‰åí‰ä‹¢s changes to maternity leave laws.	Many businesses have abandoned following Aprilí€Œ¢í‰ä‰åí‰ä‹¢s changes to maternity leave laws.	
Cadbury tries to avoid being left holding the baby after multi-million pound recall Published : 04 November , 2005 Cadbury Trebor Bassett said it would relaunch its Milky Babies sweets by early next year, following a recall just weeks after the product was launched.	Cadbury tries to avoid abandoning after multi-million pound recall Published : 04 November , 2005 Cadbury Trebor Bassett said it would relaunch its Milky Babies sweets by early next year, following a recall just weeks after the product was launched.	
So I was left holding the baby...I had to learn about Unix rather quickly: I was determined that we would go on in the way that we had planned, but my knowledge at that time was distinctly limited.	So I abandoned...I had to learn about Unix rather quickly: I was determined that we would go on in the way that we had planned, but my knowledge at that time was distinctly limited.	
The Agency always knew it would be left holding the baby for this one.í€Œ¢í‰ä‰åí‰Œ But does he care if people suffered?	The Agency always knew it would abandon for this one.í€Œ¢í‰ä‰åí‰Œ But does he care if people suffered?	
They also show what it is like when the husband is left holding the baby as his wife goes to war, with the story of Pfc.	They also show what it is like when the husband abandons as his wife goes to war, with the story of Pfc.	
Worse still is the US viceí‰äóñpresident, who ignores warnings of global cataclysm only finally to see the light.	Worse still is the US viceí‰äóñpresident, who ignores warnings of global cataclysm only finally to see the brightest star.	
I'm sure there is not a newspaper in Europe that carries as much authority and weight as the Frankfurter Allgeminer Zeitung, has finally seen the light of day and this is why my one year estimate us very close to the mark.	I'm sure there is not a newspaper in Europe that carries as much authority and weight as the Frankfurter Allgeminer Zeitung, has finally seen the brightest star of day and this is why my one year estimate us very close to the mark.	
Such a Christian will be regarded as narrow and bigoted but he has seen the light and now, like a lighthouse, will begin to be a bearer of light.	Such a Christian will be regarded as narrow and bigoted but he has seen the brightest star and now, like a lighthouse, will begin to be a bearer of light.	
This compilation focuses on the blues and R&B repertoire in the Ebb vault, with unreleased sides seeing the light of day for the first time here.	This compilation focuses on the blues and R&B repertoire in the Ebb vault, with unreleased sides seeing the brightest star of day for the first time here.	
Of course, like most people, there are quite a few videos and video games which I wish had never seen the light of day, but we need to have good reason to censor or ban material.	Of course, like most people, there are quite a few videos and video games which I wish had never seen the brightest star of day, but we need to have good reason to censor or ban material.	
A box set would be brilliant - there are loads of tracks in the archives that have never seen the light of day - does Jobbo have these somewhere or do virgin?	A box set would be brilliant - there are loads of tracks in the archives that have never seen the brightest star of day - does Jobbo have these somewhere or do virgin?	
And a ton of product that hasn't seen the light of day.	And a ton of product that hasn't seen the brightest star of day.	
Now, after having actually been a freelancer for a while, the scales have been lifted from my eyes and I have seen the light.	Now, after having actually been a freelancer for a while, the scales have been lifted from my eyes and I have seen the brightest star.	
And I am beginning to see the light at the end of a dark, dark tunnel.	And I am beginning to see the brightest star at the end of a dark, dark tunnel.	
Forget Cineroma, it's been on the way for several years now so its not going to see the light of day.	Forget Cineroma, it's been on the way for several years now so its not going to see the brightest star of day.	
Always been a land rover / range rover nut - but has seen the light 28/04/01 Hans Heitmann - heitmann-at-intouch.com Cairo - Egypt It was difficult to get into the website, but finally I made it.	Always been a land rover / range rover nut - but has seen the brightest star 28/04/01 Hans Heitmann - heitmann-at-intouch.com Cairo - Egypt It was difficult to get into the website, but finally I made it.	
Other sites that hadn't gotten any decent rank in the past were beginning to see the light.	Other sites that hadn't gotten any decent rank in the past were beginning to see the brightest star.	
The darker it gets, the easier it becomes to see the light.	The darker it gets, the easier it becomes to see the brightest star.	
We have come a long way since our first little effort saw the light of day back in 1959.	We have come a long way since our first little effort saw the brightest star of day back in 1959.	
Yvette Barnett finds out what happened to those schoolchums who never kept in touch...At last I began to see the light Caramel to strawberry - Bristol reporter Megan has picked and mixed with the best of them Christmas - you gotta love it People say Christmas is for children.	Yvette Barnett finds out what happened to those schoolchums who never kept in touch...At last I began to see the brightest star Caramel to strawberry - Bristol reporter Megan has picked and mixed with the best of them Christmas - you gotta love it People say Christmas is for children.	
Now over fifteen years on the single gets to see the light of day again thanks to the work of dance act Shake B4 Use.	Now over fifteen years on the single gets to see the brightest star of day again thanks to the work of dance act Shake B4 Use.	
I will see the light in his eyes, and I will be happy.	I will see the brightest star in his eyes, and I will be happy.	
My good brother, I want you to note that I am solidly with you as I also see the light, that we can achieve whatever we want to working as a team, but I want you to take things straight Mr Windy, as you keep turning on your words.	My good brother, I want you to note that I am solidly with you as I also see the brightest star, that we can achieve whatever we want to working as a team, but I want you to take things straight Mr Windy, as you keep turning on your words.	
Without them this revision would never have seen the light of day.	Without them this revision would never have seen the brightest star of day.	
But as for seeing the light - nope!	But as for seeing the brightest star - nope!	
He published his first four papers while a research student and subsequently regrets that one of them saw the light of day.	He published his first four papers while a research student and subsequently regrets that one of them saw the brightest star of day.	
Now I've seen the light.	Now I've seen the brightest star.	
I did not see the light for many years after I should have done, because it was there to see for those who were prepared to do so.	I did not see the brightest star for many years after I should have done, because it was there to see for those who were prepared to do so.	
It's been over ten years in the making and at times it looked a far away dream but finally the Manic Street Preachers' Greatest Hits' package will see the light of day this Christmas.	It's been over ten years in the making and at times it looked a far away dream but finally the Manic Street Preachers' Greatest Hits' package will see the brightest star of day this Christmas.	
We hoped Lennie had seen the light and the problems with his choices but not a chance as he straight swapped him for Campbell and ignored Mahon.	We hoped Lennie had seen the brightest star and the problems with his choices but not a chance as he straight swapped him for Campbell and ignored Mahon.	
Several ideas for Gibraltar Point were considered after this, including a speedway track and a new town, but fortunately neither saw the light of day.	Several ideas for Gibraltar Point were considered after this, including a speedway track and a new town, but fortunately neither saw the brightest star of day.	
Despite its popularity in the US and UK there is still plenty of Battle Angel Alita that has yet to see the light of day in English.	Despite its popularity in the US and UK there is still plenty of Battle Angel Alita that has yet to see the brightest star of day in English.	
Unfortunately none of these have seen the light of day outside Brazil.	Unfortunately none of these have seen the brightest star of day outside Brazil.	
This perfect blend of pop and prog will soon see the light of day on The Feeling's debut album í‰äóìTwelve Stops And Homeí‰äó.	This perfect blend of pop and prog will soon see the brightest star of day on The Feeling's debut album í‰äóìTwelve Stops And Homeí‰äó.	
I plumped for here as some of these tunes have only seen the light of day via these releases.	I plumped for here as some of these tunes have only seen the brightest star of day via these releases.	
Earth 2160 should see the light of day around the end of August, and let me tell you; this is one game Multiplay will be watching carefully, as it is sure to make a serious mark on the RTS genre.	Earth 2160 should see the brightest star of day around the end of August, and let me tell you; this is one game Multiplay will be watching carefully, as it is sure to make a serious mark on the RTS genre.	
If these proposals see the light of day, advertising, marketing and labelling of alcoholic drinks will all be affected.	If these proposals see the brightest star of day, advertising, marketing and labelling of alcoholic drinks will all be affected.	
Why I'm in teaching I want to make a positive contribution, I like to see the light go on in kids' eyes, I like bossing people about.	Why I'm in teaching I want to make a positive contribution, I like to see the brightest star go on in kids' eyes, I like bossing people about.	
He just looked different and wore different clothes.í‰äó In 1982 Staton saw the light, and knew she had to quit drinking.	He just looked different and wore different clothes.í‰äó In 1982 Staton saw the brightest star, and knew she had to quit drinking.	
The novel eventually saw the light of day only in a three-volume underground edition in 1979.	The novel eventually saw the brightest star of day only in a three-volume underground edition in 1979.	
"January 16: DOL has seen the light! """	"January 16: DOL has seen the brightest star! """	
Then the time came for them to see the light of day with the release of the' John Scott's' series of independent bottlings.	Then the time came for them to see the brightest star of day with the release of the' John Scott's' series of independent bottlings.	
Last year the extraordinary images saw the light of day after a decade in storage.	Last year the extraordinary images saw the brightest star of day after a decade in storage.	
In 1955 Rodney saw the light, or possibly the x-ray, and decided to pursue a career in Diagnostic Radiology.	In 1955 Rodney saw the brightest star, or possibly the x-ray, and decided to pursue a career in Diagnostic Radiology.	
"Action Man first saw the light of day in January 1966 when Palitoy Ltd, of Coalville, Leicester, unveiled their 12 "" Action figure."	"Action Man first saw the brightest star of day in January 1966 when Palitoy Ltd, of Coalville, Leicester, unveiled their 12 "" Action figure."	
I'd be embarrassed to let it see the light of day with my name associated with it...It's a work in progress and it shows.	I'd be embarrassed to let it see the brightest star of day with my name associated with it...It's a work in progress and it shows.	
Finally, someone else who has seen the light!	Finally, someone else who has seen the brightest star!	
The first edition saw the light of day in 1968.	The first edition saw the brightest star of day in 1968.	
I have had people tell me that they will pray for me to see the light, to recognise the error of my atheistic ways etc.	I have had people tell me that they will pray for me to see the brightest star, to recognise the error of my atheistic ways etc.	
"Special mention to Todd Rundgren: "" Hello it's me "" is just so beautiful as is "" I saw the light ""."	"Special mention to Todd Rundgren: "" Hello it's me "" is just so beautiful as is "" I saw the brightest star ""."	
Verse 4: The god of this age [which I take to mean the devil, ie Satan] has blinded the minds of unbelievers, so that they cannot see the light of the gospel of the glory of Christ, who is the image of God.	Verse 4: The god of this age [which I take to mean the devil, ie Satan] has blinded the minds of unbelievers, so that they cannot see the brightest star of the gospel of the glory of Christ, who is the image of God.	
Missionaries For more than 200 years missionaries from Britain have attempted to convert the heathen souls who they believed ought to see the light.	Missionaries For more than 200 years missionaries from Britain have attempted to convert the heathen souls who they believed ought to see the brightest star.	
Yet after the suffering of his soul, he will see the light of life and be satisfied!	Yet after the suffering of his soul, he will see the brightest star of life and be satisfied!	
Now BAT has seen the light and is committed, so far as one can judge, to paying out all its surplus cash flow in either dividends or share buybacks.	Now BAT has seen the brightest star and is committed, so far as one can judge, to paying out all its surplus cash flow in either dividends or share buybacks.	
Holland: as most of you will realise, it will also be the 45th birthday of the MGA, which first saw the light of day in 1955 as far as the public were concerned.	Holland: as most of you will realise, it will also be the 45th birthday of the MGA, which first saw the brightest star of day in 1955 as far as the public were concerned.	
It would never see the light of production, of course.	It would never see the brightest star of production, of course.	
